一起支持遲緩兒媽媽 ► 贊助一本童書！讓偏鄉遲緩兒能從小開始，透過閱讀進行治療,一起夢想,104810,100,https://www.zeczec.com//projects/rortaiwan-510,"這個母親節：贊助募集 300 本童書，送入 300 個弱勢家庭，陪超過 300 個孩子一起說故事。透過閱讀，能提早發現遲緩兒徵兆，讓他們有機會追上其他孩子的腳步！,zeczec",23 天,2022/05/01 00:00 – 2022/05/31 23:59
一起幫助迷惘的媽媽 ► 讓暴力不再發生、不再惡性循環，讓母親找回自己的角色,一起夢想,115620,100,https://www.zeczec.com//projects/jedidiah_510,"暴力會摧毀一個家。當不幸發生後，若能讓專業諮商、團體溝通課程及早介入，就能幫助這些有暴力風險的家庭，儘早重建關係。而飽受驚嚇的孩子們，也有機會獲得療癒、學習新的人際互動方式，避免暴力惡性循環。,zeczec",23 天,2022/05/01 00:00 – 2022/05/31 23:59
一起支援貓媽媽 ►「奶貓中繼站」為 80 隻奶貓孤兒，籌奶粉錢！,一起夢想,294488,100,https://www.zeczec.com//projects/love-animal-510,"4-6月奶貓潮，當人類在慶祝母親節，卻有一群奶貓孤兒因為不同原因失去了母親的呵護。為此，有一群熱誠的「志工貓媽媽」接下了救援任務，卻缺乏足夠的奶水食物，急需要您們的贊助，一起籌措奶粉錢！,zeczec",23 天,2022/05/01 00:00 – 2022/05/31 23:59
一起支持長照媽媽做健檢 ► 心力交瘁的照護者如果倒下，倒下的將是一個家庭,一起夢想,62610,100,https://www.zeczec.com//projects/mdvi-510,"幫 40 個單親視多障家庭，募集健康檢查與家庭訪視費，讓障礙兒的家長能夠繼續支撐下去。,zeczec",23 天,2022/05/01 00:00 – 2022/05/31 23:59
一起支持病友媽媽 ► 身為「先天性成骨不全症」的母親，每一天都小心翼翼，請幫助我守護他們！,一起夢想,168210,100,https://www.zeczec.com//projects/OI-510,"「先天性成骨不全症」的患者又俗稱「玻璃娃娃」，孩子容易反覆骨折，留下長短腳後遺症；或者因骨骼變形，出現鐮刀手、鐮刀腳、脊柱畸形、聽力不佳、肌肉無力等 ...... 要守護他們長大，困難重重！,zeczec",23 天,2022/05/01 00:00 – 2022/05/31 23:59
一起支持工傷媽媽 ► 做工的爸媽受傷後，家庭該怎麼辦呢？《陪媽媽兜風》繪本共讀巡迴計畫,一起夢想,145260,100,https://www.zeczec.com//projects/tavoi-510,"只要做工作，就可能經歷工作傷害！母親節此刻，台灣有許多工傷家庭正在經歷措手不及的艱難，而且可能就是我們周遭的同學親友。透過繪本共讀計畫，從小開始建立對於「工傷」的理解與重視。,zeczec",23 天,2022/05/01 00:00 – 2022/05/31 23:59
【日日居ZEZEGOOD｜ZEfoam零壓科技綿】睡眠新革命 三眠制釋壓床墊 挑好床枕 從“材質”開始,日日居 ZEZEGOOD,752030,2230,https://www.zeczec.com//projects/zezegood-zefoam,"挑好床枕 從“材質”開始 遍尋全球床墊材質，由專利材質出發，你知道記憶綿、乳膠、獨立筒，但你可能不知道「ZEfoam零壓科技綿」。,zeczec",29 天,2022/04/28 19:00 – 2022/06/06 23:59
Go.Do.Be.Live! | 九型探索 Discover Your Type | 九種原型人格探索指南 by Annie Ivanova,Studio Ivanova,147614,849,https://www.zeczec.com//projects/discover-your-type,"這副牌卡將協助你透過九型人格類型了解自己與他人，適用於個人發展、團隊建立、化解衝突，並且與家人和朋友分享。,zeczec",23 天,2022/04/06 21:00 – 2022/05/31 23:59
New KableCARD︱都市生存卡 2.0，搞定充電所有事，城市生存再進化！,CARD x 甲子,460984,899,https://www.zeczec.com//projects/newkablecard,"這次我們將都市生存化再進化 New kablecard 並搭配卡片系列的個人皮卡燈 CARD Light，讓個人城市生存裝備更完善 !,zeczec",23 天,2022/05/05 10:00 – 2022/05/31 23:59
【彿堤斯 | 中型寵物烘毛室】為台灣「中大型汪喵」及「多寵家庭」量身打造！,清度,1043701,16800,https://www.zeczec.com//projects/vortice,"一款專為體型 7-15 公斤的中型犬、大型貓，以及有著多隻小型寵物的家庭所設計，超越 5 星等級，寬敞、舒適、輕鬆無壓力的烘毛空間！,zeczec",28 天,2022/05/05 11:00 – 2022/06/05 23:59
TIFG日本製焚火台 | 耐重鋼板不變形，收納厚度不到1公分，營火野炊職人逸品 · TakiBeIta焚火台,Single Step,1830171,4490,https://www.zeczec.com//projects/tifg-takibeita,"露營烤肉,營火活動最值得擁有的職人焚火台，日本集資排名第一！日本香川縣TIFG鐵匠鍛造，厚實鋼板耐重不變型，組裝快速收納不到1cm！世界最美燒柴爐,zeczec",8 天,2022/04/12 12:00 – 2022/05/16 23:59
夢遊的人Dennis in Wonderland - Live session,有享娛樂,482722,800,https://www.zeczec.com//projects/Dennis_in_Wonderland,"由金馬影帝莫子儀、金曲作曲黃裕翔、非典型音樂製作人日京江羽人共同跨域創作，最跳躍邏輯的夢境之旅。,zeczec",23 天,2022/04/01 12:20 – 2022/05/31 23:59
【 Revopoint POP 2｜攜帶式 3D 全彩高精度掃描儀 】0.05mm 高精度升級，個人化逆向掃描建模王者再革新！,Revopoint 3D Taiwan,9210669,13980,https://www.zeczec.com//projects/revopoint-pop-2,"更高掃描精度，更流暢的操作，更好的色彩效果，無刺激光源的紅外掃描原理，檔案格式相容性高。自動對齊與自定義編輯功能設定，輕巧好攜帶的造型與簡易的連接方式。,zeczec",22 天,2022/03/16 12:00 – 2022/05/31 02:00
【聲藝】 學習聲音的藝術，幫助你談成生意，搞定關係,歐馬克,1416960,1980,https://www.zeczec.com//projects/metavoice,"成立一個幫助人們探索與認識自己的平台，提供文章、影音、線上課程、線下工作坊資源，讓人們可以活出理想的生活，成為心目中的自己,zeczec",36 天,2022/04/13 21:00 – 2022/06/13 23:59
為 450 多隻流浪犬貓，打造能遮風避雨的家｜浪浪庇護所修繕計畫,社團法人關懷流浪犬貓鮮食協會,371300,500,https://www.zeczec.com//projects/FCD02,"我們目前收容流浪犬貓的園區，僅有陽春的帆布遮雨，而且時常大積水，容易造成疾病。希望集結善心人士，募集改建經費。讓救援後的動物，能有個遮風避雨的的家。,zeczec",53 天,2022/04/01 10:00 – 2022/06/30 23:59
RAF KAMPO 純分離植萃乳清蛋白｜最適合華人的乳清蛋白｜需要的營養一包搞定｜專利成份劑量清楚｜獨家腸道保護配方,RAF KAMPO,325640,2580,https://www.zeczec.com//projects/rafkampo,"全新舒眠配方與晶亮配方，是您補充蛋白質同時修護機能的新選擇。選用多國專利成份，安心有保障，每份均含有25公克以上蛋白質。,zeczec",45 天,2022/05/08 12:00 – 2022/06/22 23:59
【 OTUS 奧特視｜視力訓練智慧眼鏡 2 】眼部訓練全新升級，智慧管理輕鬆保持好視力。,OTUS Taiwan,3069101,11480,https://www.zeczec.com//projects/otus-2,"眼部訓練全新升級，智慧管理輕鬆保持好視力。你全家的視力，繼續由奧特視來守護。一代近800名贊助者使用肯定，團隊聽取使用意見再度改進； 美國藍圖療法加持，AI 智慧分析改進， 更好用的 APP 設...,zeczec", 40 小時,2022/04/06 12:00 – 2022/05/11 02:00
Smio.V 美妍小 V ✦ 4 in 1 溫冷緊緻按摩儀，在家就能享受的頂級 SPA 舒壓保養！,lisscode,8396273,2180,https://www.zeczec.com//projects/lisscode-smio-v,"台灣設計製造，一機結合導入、冰敷、按摩、刮痧，從臉到腳全方位完美貼合，舒壓與保養一次滿足。維持你最美狀態的秘密武器！,zeczec", 40 小時,2022/03/08 12:00 – 2022/05/11 02:00
 數感宇宙探索課程｜為國小生打造的生活數學 DIY 影音學習組｜給孩子一堂不一樣的數學課,數感實驗室,2400670,1790,https://www.zeczec.com//projects/numeracymaker,"本課程結合數感實驗室逾 10 年數學教育經驗、史丹佛大學「成長型數學思維」理論。內容針對國小中年級以上的孩子，強調具體、跨域、手作、情境。鼓勵孩子探索思考，讓孩子愛上數學。,zeczec",50 天,2022/05/04 12:00 – 2022/06/28 02:00
MUFU V30P 好神機｜前後雙錄機車行車記錄器｜內建違規偵測語音播報提醒功能幫你『省荷包』,MUFU,5595624,3890,https://www.zeczec.com//projects/mufu-v30p,"MUFU機車行車記錄器安裝使用很簡單，前後雙錄記錄影像，獨創違規點偵測語音播報，為國民省荷包，機車族必備好神機,zeczec",33 天,2022/04/07 11:00 – 2022/06/10 23:59
MiniBle X 微氣泡起波器｜清潔、除菌、去農殘，一顆搞定｜家用微氣泡革命，居家用水品質大升級！,HerherS和荷時際,4307582,1750,https://www.zeczec.com//projects/minible-x,"從台灣開始，我們想要繼續照顧地球，實踐每個家裡都擁有微氣泡的承諾。,zeczec",15 天,2022/04/19 20:00 – 2022/05/24 02:30
SGS PRO 智慧迷你雕刻拋光筆｜無線便攜，雕刻、打磨、拋光的最佳助手！,Arrowmax Taiwan,782490,2280,https://www.zeczec.com//projects/sgs-pro-smart-mini-electric-engraving-polishing-pen,"Arrowmax 便攜式智能工具套組 系列中的第三款『SGS PRO』 - 作為一個小型無線智能工具 讓你在任何時候都能隨意雕刻、研磨、打磨和拋光任何物件。,zeczec",23 天,2022/04/07 12:00 – 2022/05/31 23:59
【日本島產業SHIMA SANGYO｜廚餘除臭乾燥機】溫風烘乾廚餘、活性碳設計有效除臭，美型無刀片好清洗!,Suntrail,463780,9990,https://www.zeczec.com//projects/shima-sangyo,"日本廚餘機領導品牌｜溫風烘乾乾燥廚餘、活性碳除臭、運轉超靜音、免安裝插電即可用，無刀片更好洗的廚餘機。美型小巧榮獲多項國際設計大賞。 ,zeczec",7 天,2022/04/08 09:00 – 2022/05/15 23:59
日本國寶級工藝輪島塗職人手工打造｜輪島漆萬用料理鏟｜田谷漆器店,KK select,1383601,1750,https://www.zeczec.com//projects/wajimanuri2,"擁有 200 年以上歷史的田谷漆器店，改良國寶級工藝輪島塗職人工具所製成的第二代萬用料理鏟，雙重抗菌保護，再也不擔心木鏟發霉！,zeczec",4 天,2022/04/12 12:00 – 2022/05/12 23:59
【 Tairona R-01｜真．輕巧，掌上劇院 】小巧便攜，畫質清晰。小體積，大「視」界！滿足你從 居家生活 到 戶外旅遊！,inaday's,8796496,8888,https://www.zeczec.com//projects/tairona-r-01-l-4k,"inaday's 首次推出 [ 掌上劇院 ]，堅持品質及功能性一致，絕對顛覆你對微型投影機的既定印象!!!,zeczec",18 天,2022/04/19 11:00 – 2022/05/26 23:59
【雲米】方糖洗碗機 - 「我不想洗碗！」入手人生第一台免安裝洗碗機,雲米 VIOMI,5394801,7990,https://www.zeczec.com//projects/sugar,"萬元內、免安裝、超省水！比手洗省 10 倍水量，16 道強力水柱＋UVC 99.99% 強力殺菌，一鍵按下，讓曾經的洗碗惡夢，變得簡單俐落。,zeczec",29 天,2022/05/05 12:00 – 2022/06/07 02:00
韓國 HYUNDAI 捲捲地板｜輕輕一滾，DIY居家改造超easy！吸震隔音、軟底設計，寵物嬰兒都安心！,韓國 Hyundai 現代科技家居,537430,2180,https://www.zeczec.com//projects/hyundai-rolling-floor,"韓國 HYUNDAI 最新「捲捲地板」，不僅擁有舒適腳感，更能吸震隔音，九大功能輕鬆幫您解決家裡傳統地板的問題，最重要的是：自己鋪5坪地板只要1小時，租屋族也能輕鬆上手！,zeczec",41 天,2022/05/05 12:00 – 2022/06/19 02:00
2022 閱讀島中央 週三讀書會｜現場與線上講座同步啟動,財團法人上善人文基金會中央書局,1424000,1200,https://www.zeczec.com//projects/cbs_wed_reading_s3,"老店新生，以創造風潮的讀書會，繼承中台灣的人文精神。從臺中中央書局出發到全臺的閱讀熱情,邀請你繼續參加這個盛大的閱讀計畫,由詹宏志、王浩威、曾成德、焦元溥、楊澤等5位講師組成黃金陣容,線上/現場...,zeczec",15 天,2022/03/23 21:00 – 2022/05/23 23:59
石頭掃拖機器人 S7 MaxV Ultra ｜五項全自動．六合一清潔座搭載業界最強5100PA吸力，掃地機界真王者！,Roborock Taiwan,141013816,39888,https://www.zeczec.com//projects/roborock-s7-maxv-ultra,"全球最大的掃地機器人製造商Roborock石頭科技， 推出全新頂級旗艦機種 —S7 MaxV Ultra ▶︎ 重金打造旗艦高規格機款，再次顛覆你對掃地機的想像！做到讓您真正解放雙手！,zeczec", 14 小時,2022/04/12 10:00 – 2022/05/09 23:59
【 SAMSUNG｜Bespoke Jet™ 】三星風暴級無線變頻吸塵器，韓國熱銷超過 30 萬台 ✧ 科技美型 1.44KG 極輕設計，獨立集塵充電座，210W 超強吸力！,samsung,1819800,34400,https://www.zeczec.com//projects/samsung-bespoke-jet,"吸地、拖地、集塵，這台通通搞定！一機包辦，灰塵零接觸！全機 2 年保固，主機馬達 10 年保固！,zeczec",9 天,2022/04/19 12:00 – 2022/05/18 02:00
《瀕臨絕種團RESCUTE》訂閱服務,春魚,54010,99,https://www.zeczec.com//projects/rescute,"臺灣瀕臨絕種動物擬人，並組成女團出道，為自己的生存權發聲。期許透過虛擬偶像的經營，向更多一般大眾傳遞野生動物保育知識與資訊。,zeczec",,開始於2020/10/15 20:00
毛孩的最後一哩路,毛孩的彩虹天堂,583659,50,https://www.zeczec.com//projects/Pet-Paradise2019-02-20,"在世界的各個⾓落，總能見到浪浪的身影，他們⼀生孤單、飢餓的在街頭流浪， 而等待他們的終點，常常是像垃圾一樣被丟棄。 我們是毛孩的彩虹天堂，我們希望浪浪也能好好走完最後⼀哩路，能有圓滿的善終。,zeczec",,開始於2019/02/20 09:00
《島民居住可愛計畫》｜居住議題紀錄片影集募資,持續滾動影像有限公司,10777,99,https://www.zeczec.com//projects/zhaizhaitogether,"透過影像專業的技能，記錄台灣合作住宅發展的推動過程，提供島民一個友善、可負擔的居住新選擇。,zeczec",,開始於2021/05/14 20:00
《WalkingBlock徒步街廓》屬於都會人的電子雜誌,臺北市青年支持未來都會再生協會,499,200,https://www.zeczec.com//projects/WalkingBlock,"支持永續行動其實很簡單，透過WalkingBlock發掘大台北更多的未來可能，並開始思考如何讓這座城市變得更美好。,zeczec",,開始於2022/05/06 17:00
《 The Big Issue 大誌雜誌 》 疫情期應變訂閱方案,The Big Issue 大誌雜誌,150489,3360,https://www.zeczec.com//projects/the-big-issue,"2020 年開始的一場疫情改變了人類的生活，為了減緩疫情對大誌雜誌街頭販售員的衝擊，我們啟動了「短期訂閱服務」—— 您可以將這筆訂閱，指定給您經常購買的販售點之販售員，或交由我們來分配安排給販售...,zeczec",,開始於2021/05/18 23:20
敏迪選讀-手機裡的國際新聞台,敏迪,98080,59,https://www.zeczec.com//projects/mindynews,"支持【敏迪選讀】提供更親民、更寓教於樂的國際新聞,zeczec",,開始於2019/06/14 08:00
GMR AI智能消噪器｜耳機的救星『改善通話品質與優化音質神器』,GMR,104298,940,https://www.zeczec.com//projects/GMR-AI-Adapter,"GMR AI智能『CleanSound』降噪技術，讓你使用耳機時，不再受環境噪音影響，提供你超優質的通話品質與超高的音效體驗,zeczec",,2022/03/23 20:00 – 2022/05/08 23:59
【降雨機率】世新大學圖文傳播暨數位出版學系第二十八屆畢業展,世新大學圖傳系28屆畢業展覽 降雨機率,10150,100,https://www.zeczec.com//projects/POP_GCDP,"我們是世新大學圖文傳播暨數位出版學系大四學生，將於5/6~9舉辦校外展覽，共有106位同學的作品以自身所學進行創作，並於松山文創園區北向製菸工廠展出。,zeczec",,2022/04/01 22:10 – 2022/05/08 23:59
expertgel樂捷│超薄型！極致吸濕【消臭鞋墊】│奈米礦物機能紗的科學消臭原理│比硅藻土吸濕,愛倍多國際股份有限公司,134018,348,https://www.zeczec.com//projects/expertgel_Ultra-slim_Extremely_Hygroscopic_Deodorizing_Insole,"超薄無感『僅1.2mm』│多方驗證『抗菌消臭』│調節溫度『冬暖夏涼』│遠紅外線『促進循環』│超透結構『乾爽舒適』│奈米導體『吸收熱氣』│微孔科技『快速吸濕導流多餘水份』,zeczec",,2022/04/06 20:00 – 2022/05/08 00:00
燕麥抹醬新體驗｜穀卡卡瑞士主廚研發｜可塗抹的燕麥脆片,Granola Gaga 穀卡卡工作室,50195,520,https://www.zeczec.com//projects/granolagaga-granolabutter,"第一個在台灣推出的燕麥抹醬！瑞士主廚兩年專業研發出成分單純、無過敏原、高營養、高膳食纖維的無負擔燕麥抹醬,zeczec",,2022/03/24 11:00 – 2022/05/07 23:59
低衝擊！關節、心肺零負擔！改變世界的家常運動：iNO 太空人律動機,iNO,114444900,16800,https://www.zeczec.com//projects/ino-600,"40年來千篇醫學論文證實【律動】是最簡單、輕鬆、安全的運動。30年前的太空人失去地心引力無法運動，而現代高齡化、忙碌沒時間運動的我們，就是太空人！,zeczec",,2021/12/15 12:00 – 2022/01/10 23:59
一秒變換風格，只要翻轉背包 - FlipBag™ by Allrover™,allrover®,69245122,730,https://www.zeczec.com//projects/flipbag,"FlipBag™ 翻轉背包，藉由專利的超快速變形結構「FLIP MECH +」，手提包一秒變成後背包，伴隨你的身份或場所的變化。出門不用再多帶一個包包，搭配風格由你決定。,zeczec",,2016/06/01 00:00 – 2016/08/10 23:59
【 萬播 T2R Max｜攜帶式微型投影機 】嘖嘖全球唯一首發！最強 CP 值，帶著走的行動劇院！,睿濬國際,40318600,7180,https://www.zeczec.com//projects/wanbo,"海外投影機類熱銷冠軍品牌，為使用者帶來全新沉浸式娛樂體驗。追劇、打 Game 不想再被侷限? 小空間也可以有大改變，台灣全球首發，CP 值最高的微型可支援 4K 投影機！,zeczec",,2021/04/27 12:00 – 2021/06/24 02:00
Stair-Rover™ - 八輪滑板讓你遨遊城市 毫無阻攔,allrover®,39062040,5980,https://www.zeczec.com//projects/allrover,"Stair-Rover是一塊能讓你在都市衝浪遨遊的滑板，板如其名，它獨特的八輪設計不但能跨越各種都市地形，更能讓你從樓梯頂端一衝而下，體會在水泥叢林浪端滑翔的快感！,zeczec",,2014/08/25 00:00 – 2014/10/20 23:59
「煎出世界上最好吃的牛排，就跟呼吸一樣簡單！」Omoi frying pan無塗層鑄鐵煎鍋台灣初登場！,KK select,1767571,3890,https://www.zeczec.com//projects/omoi-frying-pan,"保留鑄鐵熱傳導優良特性．煎面加厚設計．無塗層可用一輩子。只要有這把神鍋，就能省下上高級牛排餐館的費用，在家也能享用又香又嫩的美味牛排！,zeczec",19 天,2022/04/28 12:00 – 2022/05/28 02:00
地表最強露營燈【日本 ROOT CO. HEX-SoLa ver.2 戶外露營燈】｜獨創六角形設計，360度無死角的極致機能,攜帶電話,1584260,3190,https://www.zeczec.com//projects/root-co-hex-sola-ver2,"來自日本箱根，Outdoor職人品牌｜日本 ROOT CO. ，最親近大自然的設計理念，首次登上嘖嘖，挑戰地表最強露營燈，360度無死角的極致機能！,zeczec",23 天,2022/04/26 11:00 – 2022/05/31 23:59
《 Roidmi 睿米 X300 無線吸拖吸塵器 》1 鍵自動 吸拖/清洗/瀝乾｜27000 Pa 頂規吸塵力｜90 分鐘超長續航,Roidmi Taiwan 睿米,1501580,19980,https://www.zeczec.com//projects/roidmi-x300,"連最麻煩的清洗髒拖布都能解放雙手，才是真正實現全自動潔淨！專為懶人族設計、整合市場旗艦機型的全方位功能 ───「最強 CP 值無線吸拖吸塵器」登場！,zeczec",9 天,2022/04/06 21:00 – 2022/05/17 23:59
【 Royal 鼻毛刀套組】承襲韓國六十年傳統工藝，絕對安全、俐落剪斷不扯毛，輕輕轉一轉，整個人煥然一新！,Backer Choice 貝殼選物,1077022,1999,https://www.zeczec.com//projects/royal-metal,"左邊轉轉、右邊轉轉，5 秒無痛清理鼻毛超簡單！一套擁有精品質感的不銹鋼鼻毛刀套組，絕對安全、無須充電且可拆卸水洗， 7.2cm 輕巧帶著走，上班、約會前快速轉一轉，在重要時刻不凸槌，俐落又帥氣！,zeczec",32 天,2022/04/26 12:00 – 2022/06/09 23:59
【源興牛飼育計畫】- 來募台灣人的和牛，自己和牛自己養 ! ,群眾自造,4845186,2990,https://www.zeczec.com//projects/Tw-Ag-Mou,"【源興牛】是李登輝前總統留給我們最棒的禮物，李前總統曾說過「要讓臺灣人吃到比日本還好吃的牛肉」。為了完成這個夢想、讓臺灣人能擁有屬於臺灣人的優質牛肉，源興牛飼育計畫需要每一個你的支持！,zeczec", 38 小時,2022/03/22 11:00 – 2022/05/10 23:59
全台首發 📣 樂扣樂扣｜微笑騎士不鏽鋼隨行杯｜可提可掛不怕漏，莫蘭迪質感配色，讓你隨時享受喝飲料樂趣 ! ,台灣樂扣樂扣,2177356,888,https://www.zeczec.com//projects/locknlocktw,"專為台灣機車族打造，不鏽鋼提把設計，隨手提隨處掛輕鬆帶著走，同時擁有樂扣樂扣高品質密封設計，外出放入包包、機車車廂中不怕飲料溢出，又能地球環保盡一份心力。,zeczec",9 天,2022/03/23 12:00 – 2022/05/17 23:59
超音波⚡隨身清洗盒｜99.9% 潔淨力，補氧+保濕+清潔，一機到位！,Future Clean⁺,4802486,999,https://www.zeczec.com//projects/future-clean,"一鍵清潔，將平常清不到的髒污、灰塵通通震飛！搭載 IPX5 級防水、超高續航、補光燈，不論居家出門，一盒全搞定！,zeczec",8 天,2022/03/08 20:00 – 2022/05/17 02:00
✹ PILMOA 迷你露營燒柴爐 ✹｜露營在走・行頭要有－最 mini、最 PRO 的露營好火伴 .ᐟ ,PILMOA,2103770,4200,https://www.zeczec.com//projects/pilmoa-mini-pro,"日韓集資累計 1000 萬以上的露營質感炫風－ PILMOA 迷你露營燒柴爐來了 .ᐟ 1 秒組裝，10 秒收納，最小、最高質感直接開露 .ᐟ ,zeczec", 14 小時,2022/03/17 20:00 – 2022/05/09 23:59
日本超人氣【 ISSENO ! 塑身蹦蹦墊】跟痛苦的健身說 莎喲娜拉~,Neo Choice ,1693425,3390,https://www.zeczec.com//projects/isseno,"只要彈跳10分鐘，就能幫助淋巴增強運作30倍，高效有氧運動。 在日本成為熱門話題的新型健身器材。 全家一起享受ISSENO!塑身蹦蹦墊帶來的快樂健身吧！,zeczec",23 天,2022/03/29 21:00 – 2022/05/31 23:59
InBirdie TEMPO 智慧型高爾夫推桿練習器｜搭載 AI 技術，精準測量三大數值！在家也能精進推桿技巧，加強推桿訓練品質！,DMBH Taiwan,1209876,8500,https://www.zeczec.com//projects/inbirdie-tempo,"韓國專利技術新產品，透過 AI 感測器偵測推桿節奏、距離、角度 3 項數據；深入練習推桿技巧，提升推桿準確度，讓你在球場上展現完美一擊！,zeczec",30 天,2022/04/26 20:00 – 2022/06/08 02:00
【IDMIX / P140 / 140W GaN 氮化鎵快速充電器】爆猛 140W 充電王者降臨！同級最高功率、支援 PD3.1、2C1A 強效輸出！,Chic Flott 奇舫優選,630673,1980,https://www.zeczec.com//projects/idmix-p140-140w-gan-140w-2c1a,"同級最高規格 140W 輸出功率，可支援 MacBook Pro 全速充電 & 眾多品牌之筆記型電腦、平板電腦、智慧型手機進行充電，日用、差旅、辦公、出遊，就這麼一顆，搞定你的充電事！,zeczec",37 天,2022/04/15 12:00 – 2022/06/14 23:59
雲林北港『鮮烘黑金剛花生』，可愛阿公75年的在地情懷，香脆濃郁無添加。【尋農高手】,尋農高手,27220,300,https://www.zeczec.com//projects/pzhang-ri-rong,"位在雲林北港今年已86歲的花生阿公，自年輕起就開始種植花生，對於花生的栽培經驗非常豐富，多年來堅守著對花生與土地的情誼，種出最優質可口的黑金剛花生！,zeczec",7 天,2022/04/18 12:00 – 2022/05/15 23:59
邏輯解謎｜密室逃脫桌遊 破解古老的秘密,Amodas,929230,1490,https://www.zeczec.com//projects/escapewelt-puzzle-tw,"我們把實境密室逃脫縮小了，德國進口全木製，運用你的邏輯破解密碼，得到最後的智慧！,zeczec",23 天,2022/03/22 12:00 – 2022/06/01 02:00
 The Marglobel 麥哲倫地球儀｜一起重回大航海時代 創造屬於您的冒險故事,質木模型,669650,1850,https://www.zeczec.com//projects/marglobel,"麥哲倫地球儀，以麥哲倫航行全球為設計概念，USB馬達電動自轉，3D展示海洋分布和陸地結構，不只是有趣的桌上擺飾，也是精緻的科學教材，707個零件，絕對能讓您感受DIY組裝的樂趣。,zeczec",44 天,2022/05/04 21:00 – 2022/06/22 02:00
《請上車》爽快的路徑規劃紙筆遊戲，在倫敦和紐約公車設立最受歡迎的巴士路線吧！,栢龍玩具,182190,750,https://www.zeczec.com//projects/Get-on-Board,"請上車是一款爽快的路徑規劃紙筆遊戲，比起一般的紙筆遊戲，有著高度的玩家互動且精美的遊戲配件，更有超乎想像的重玩性。,zeczec",7 天,2022/04/15 12:00 – 2022/05/15 23:59
屏東萬巒｜硫黃百香果春天出品,保證責任屏東縣廣益青果生產合作社,1598,666,https://www.zeczec.com//projects/passionfruitgunagyi2,"種植百香果跟科學有甚麼關係呢?百香果的殼居然可以吃?我們蒐集各種百香果創意料理，私廚食譜送給你！,zeczec",13 天,2022/04/23 08:00 – 2022/05/21 23:59
